title,abstract,published,categories,pdf_url
Simultaneous Genetic Evolution of Neural Networks for Optimal SFC Embedding,"The reliance of organisations on computer networks is enabled by network programmability, which is typically achieved through Service Function Chaining. These chains virtualise network functions, link them, and programmatically embed them on networking infrastructure. Optimal embedding of Service Function Chains is an NP-hard problem, with three sub-problems, chain composition, virtual network function embedding, and link embedding, that have to be optimised simultaneously, rather than sequentially, for optimal results. Genetic Algorithms have been employed for this, but existing approaches either do not optimise all three sub-problems or do not optimise all three sub-problems simultaneously. We propose a Genetic Algorithm-based approach called GENESIS, which evolves three sine-function-activated Neural Networks, and funnels their output to a Gaussian distribution and an A* algorithm to optimise all three sub-problems simultaneously. We evaluate GENESIS on an emulator across 48 different data centre scenarios and compare its performance to two state-of-the-art Genetic Algorithms and one greedy algorithm. GENESIS produces an optimal solution for 100% of the scenarios, whereas the second-best method optimises only 71% of the scenarios. Moreover, GENESIS is the fastest among all Genetic Algorithms, averaging 15.84 minutes, compared to an average of 38.62 minutes for the second-best Genetic Algorithm.",2025-12-10 05:06:13+00:00,"['cs.NE', 'cs.AI']",https://arxiv.org/pdf/2512.09318v1
Functional Percolation: A Perspective on Criticality of Form and Function,"Understanding the physical constraints and minimal conditions that enable information processing in extended systems remains a central challenge across disciplines, from neuroscience and artificial intelligence to social and physical networks. Here we study how network connectivity both limits and enables information processing by analyzing random networks across the structural percolation transition. Using cascade-mediated dynamics as a minimal and universal mechanism for propagating state-dependent responses, we examine structural, functional, and information-theoretic observables as functions of mean degree in Erdos-Renyi networks. We find that the emergence of a giant connected component coincides with a sharp transition in realizable information processing: complex input-output response functions become accessible, functional diversity increases rapidly, output entropy rises, and directed information flow quantified by transfer entropy extends beyond local neighborhoods. These coincident transitions define a regime of functional percolation, referring to a sharp expansion of the space of realizable input-output functions at the structural percolation transition. Near criticality, networks exhibit a Pareto-optimal tradeoff between functional complexity and diversity, suggesting that percolation criticality provides a universal organizing principle for information processing in systems with local interactions and propagating influences.",2025-12-10 05:05:10+00:00,"['physics.soc-ph', 'cond-mat.stat-mech', 'cs.AI', 'physics.comp-ph']",https://arxiv.org/pdf/2512.09317v2
Hetero-SplitEE: Split Learning of Neural Networks with Early Exits for Heterogeneous IoT Devices,"The continuous scaling of deep neural networks has fundamentally transformed machine learning, with larger models demonstrating improved performance across diverse tasks. This growth in model size has dramatically increased the computational resources required for the training process. Consequently, distributed approaches, such as Federated Learning and Split Learning, have become essential paradigms for scalable deployment. However, existing Split Learning approaches assume client homogeneity and uniform split points across all participants. This critically limits their applicability to real-world IoT systems where devices exhibit heterogeneity in computational resources. To address this limitation, this paper proposes Hetero-SplitEE, a novel method that enables heterogeneous IoT devices to train a shared deep neural network in parallel collaboratively. By integrating heterogeneous early exits into hierarchical training, our approach allows each client to select distinct split points (cut layers) tailored to its computational capacity. In addition, we propose two cooperative training strategies, the Sequential strategy and the Averaging strategy, to facilitate this collaboration among clients with different split points. The Sequential strategy trains clients sequentially with a shared server model to reduce computational overhead. The Averaging strategy enables parallel client training with periodic cross-layer aggregation. Extensive experiments on CIFAR-10, CIFAR-100, and STL-10 datasets using ResNet-18 demonstrate that our method maintains competitive accuracy while efficiently supporting diverse computational constraints, enabling practical deployment of collaborative deep learning in heterogeneous IoT ecosystems.",2025-12-10 04:58:26+00:00,"['cs.LG', 'cs.AI']",https://arxiv.org/pdf/2512.09313v1
Scene-agnostic Hierarchical Bimanual Task Planning via Visual Affordance Reasoning,"Embodied agents operating in open environments must translate high-level instructions into grounded, executable behaviors, often requiring coordinated use of both hands. While recent foundation models offer strong semantic reasoning, existing robotic task planners remain predominantly unimanual and fail to address the spatial, geometric, and coordination challenges inherent to bimanual manipulation in scene-agnostic settings. We present a unified framework for scene-agnostic bimanual task planning that bridges high-level reasoning with 3D-grounded two-handed execution. Our approach integrates three key modules. Visual Point Grounding (VPG) analyzes a single scene image to detect relevant objects and generate world-aligned interaction points. Bimanual Subgoal Planner (BSP) reasons over spatial adjacency and cross-object accessibility to produce compact, motion-neutralized subgoals that exploit opportunities for coordinated two-handed actions. Interaction-Point-Driven Bimanual Prompting (IPBP) binds these subgoals to a structured skill library, instantiating synchronized unimanual or bimanual action sequences that satisfy hand-state and affordance constraints. Together, these modules enable agents to plan semantically meaningful, physically feasible, and parallelizable two-handed behaviors in cluttered, previously unseen scenes. Experiments show that it produces coherent, feasible, and compact two-handed plans, and generalizes to cluttered scenes without retraining, demonstrating robust scene-agnostic affordance reasoning for bimanual tasks.",2025-12-10 04:37:07+00:00,['cs.RO'],https://arxiv.org/pdf/2512.09310v1
One-Shot Real-World Demonstration Synthesis for Scalable Bimanual Manipulation,"Learning dexterous bimanual manipulation policies critically depends on large-scale, high-quality demonstrations, yet current paradigms face inherent trade-offs: teleoperation provides physically grounded data but is prohibitively labor-intensive, while simulation-based synthesis scales efficiently but suffers from sim-to-real gaps. We present BiDemoSyn, a framework that synthesizes contact-rich, physically feasible bimanual demonstrations from a single real-world example. The key idea is to decompose tasks into invariant coordination blocks and variable, object-dependent adjustments, then adapt them through vision-guided alignment and lightweight trajectory optimization. This enables the generation of thousands of diverse and feasible demonstrations within several hour, without repeated teleoperation or reliance on imperfect simulation. Across six dual-arm tasks, we show that policies trained on BiDemoSyn data generalize robustly to novel object poses and shapes, significantly outperforming recent baselines. By bridging the gap between efficiency and real-world fidelity, BiDemoSyn provides a scalable path toward practical imitation learning for complex bimanual manipulation without compromising physical grounding.",2025-12-10 03:48:16+00:00,['cs.RO'],https://arxiv.org/pdf/2512.09297v1
Identifying Bias in Machine-generated Text Detection,"The meteoric rise in text generation capability has been accompanied by parallel growth in interest in machine-generated text detection: the capability to identify whether a given text was generated using a model or written by a person. While detection models show strong performance, they have the capacity to cause significant negative impacts. We explore potential biases in English machine-generated text detection systems. We curate a dataset of student essays and assess 16 different detection systems for bias across four attributes: gender, race/ethnicity, English-language learner (ELL) status, and economic status. We evaluate these attributes using regression-based models to determine the significance and power of the effects, as well as performing subgroup analysis. We find that while biases are generally inconsistent across systems, there are several key issues: several models tend to classify disadvantaged groups as machine-generated, ELL essays are more likely to be classified as machine-generated, economically disadvantaged students' essays are less likely to be classified as machine-generated, and non-White ELL essays are disproportionately classified as machine-generated relative to their White counterparts. Finally, we perform human annotation and find that while humans perform generally poorly at the detection task, they show no significant biases on the studied attributes.",2025-12-10 03:34:12+00:00,"['cs.CL', 'cs.AI']",https://arxiv.org/pdf/2512.09292v1
UPETrack: Unidirectional Position Estimation for Tracking Occluded Deformable Linear Objects,"Real-time state tracking of Deformable Linear Objects (DLOs) is critical for enabling robotic manipulation of DLOs in industrial assembly, medical procedures, and daily-life applications. However, the high-dimensional configuration space, nonlinear dynamics, and frequent partial occlusions present fundamental barriers to robust real-time DLO tracking. To address these limitations, this study introduces UPETrack, a geometry-driven framework based on Unidirectional Position Estimation (UPE), which facilitates tracking without the requirement for physical modeling, virtual simulation, or visual markers. The framework operates in two phases: (1) visible segment tracking is based on a Gaussian Mixture Model (GMM) fitted via the Expectation Maximization (EM) algorithm, and (2) occlusion region prediction employing UPE algorithm we proposed. UPE leverages the geometric continuity inherent in DLO shapes and their temporal evolution patterns to derive a closed-form positional estimator through three principal mechanisms: (i) local linear combination displacement term, (ii) proximal linear constraint term, and (iii) historical curvature term. This analytical formulation allows efficient and stable estimation of occluded nodes through explicit linear combinations of geometric components, eliminating the need for additional iterative optimization. Experimental results demonstrate that UPETrack surpasses two state-of-the-art tracking algorithms, including TrackDLO and CDCPD2, in both positioning accuracy and computational efficiency.",2025-12-10 03:14:12+00:00,['cs.RO'],https://arxiv.org/pdf/2512.09283v1
FBA$^2$D: Frequency-based Black-box Attack for AI-generated Image Detection,"The prosperous development of Artificial Intelligence-Generated Content (AIGC) has brought people's anxiety about the spread of false information on social media. Designing detectors for filtering is an effective defense method, but most detectors will be compromised by adversarial samples. Currently, most studies exposing AIGC security issues assume information on model structure and data distribution. In real applications, attackers query and interfere with models that provide services in the form of application programming interfaces (APIs), which constitutes the black-box decision-based attack paradigm. However, to the best of our knowledge, decision-based attacks on AIGC detectors remain unexplored. In this study, we propose \textbf{FBA$^2$D}: a frequency-based black-box attack method for AIGC detection to fill the research gap. Motivated by frequency-domain discrepancies between generated and real images, we develop a decision-based attack that leverages the Discrete Cosine Transform (DCT) for fine-grained spectral partitioning and selects frequency bands as query subspaces, improving both query efficiency and image quality. Moreover, attacks on AIGC detectors should mitigate initialization failures, preserve image quality, and operate under strict query budgets. To address these issues, we adopt an ``adversarial example soup'' method, averaging candidates from successive surrogate iterations and using the result as the initialization to accelerate the query-based attack. The empirical study on the Synthetic LSUN dataset and GenImage dataset demonstrate the effectiveness of our prosed method. This study shows the urgency of addressing practical AIGC security problems.",2025-12-10 02:38:47+00:00,"['cs.CR', 'cs.AI']",https://arxiv.org/pdf/2512.09264v1
GLACIA: Instance-Aware Positional Reasoning for Glacial Lake Segmentation via Multimodal Large Language Model,"Glacial lake monitoring bears great significance in mitigating the anticipated risk of Glacial Lake Outburst Floods. However, existing segmentation methods based on convolutional neural networks (CNNs) and Vision Transformers (ViTs), remain constrained to pixel-level predictions, lacking high-level global scene semantics and human-interpretable reasoning. To address this, we introduce GLACIA (\textbf{G}lacial \textbf{LA}ke segmentation with \textbf{C}ontextual \textbf{I}nstance \textbf{A}wareness), the first framework that integrates large language models with segmentation capabilities to produce both accurate segmentation masks and corresponding spatial reasoning outputs. We construct the Glacial Lake Position Reasoning (GLake-Pos) dataset pipeline, which provides diverse, spatially grounded question-answer pairs designed to overcome the lack of instance-aware positional reasoning data in remote sensing. Comparative evaluation demonstrate that GLACIA (mIoU: 87.30) surpasses state-of-the-art method based on CNNs (mIoU: 78.55 - 79.01), ViTs (mIoU: 69.27 - 81.75), Geo-foundation models (mIoU: 76.37 - 87.10), and reasoning based segmentation methods (mIoU: 60.12 - 75.66). Our approach enables intuitive disaster preparedness and informed policy-making in the context of rapidly changing glacial environments by facilitating natural language interaction, thereby supporting more efficient and interpretable decision-making. The code is released on https://github.com/lalitmaurya47/GLACIA",2025-12-10 02:11:48+00:00,"['cs.CV', 'cs.AI']",https://arxiv.org/pdf/2512.09251v1
A Clinically Interpretable Deep CNN Framework for Early Chronic Kidney Disease Prediction Using Grad-CAM-Based Explainable AI,"Chronic Kidney Disease (CKD) constitutes a major global medical burden, marked by the gradual deterioration of renal function, which results in the impaired clearance of metabolic waste and disturbances in systemic fluid homeostasis. Owing to its substantial contribution to worldwide morbidity and mortality, the development of reliable and efficient diagnostic approaches is critically important to facilitate early detection and prompt clinical management. This study presents a deep convolutional neural network (CNN) for early CKD detection from CT kidney images, complemented by class balancing using Synthetic Minority Over-sampling Technique (SMOTE) and interpretability via Gradient-weighted Class Activation Mapping (Grad-CAM). The model was trained and evaluated on the CT KIDNEY DATASET, which contains 12,446 CT images, including 3,709 cyst, 5,077 normal, 1,377 stone, and 2,283 tumor cases. The proposed deep CNN achieved a remarkable classification performance, attaining 100% accuracy in the early detection of chronic kidney disease (CKD). This significant advancement demonstrates strong potential for addressing critical clinical diagnostic challenges and enhancing early medical intervention strategies.",2025-12-10 02:03:59+00:00,"['cs.CV', 'cs.AI']",https://arxiv.org/pdf/2512.09244v1
CORE: A Conceptual Reasoning Layer for Large Language Models,"Large language models handle single-turn generation well, but multi-turn interactions still require the model to reconstruct user intent and task state from an expanding token history because internal representations do not persist across turns. This token-first paradigm leads to drift, inconsistent reasoning modes, and growing prompts as conversations deepen. We propose CORE, a concept-first interaction layer that improves multi-turn stability without modifying model weights. CORE combines a small library of universal cognitive operators with a persistent Local Concept - a compact semantic state capturing the task, constraints, preferences, and intermediate results. Each model call receives only this concept state, the user's latest instruction, and the selected operator, eliminating the need to replay full history. A preliminary prototype simulating CORE's behavior shows about 42% reduction in cumulative prompt tokens, though this number reflects prototype conditions and should not be interpreted as a real-world performance estimate. CORE offers a model-agnostic mechanism that separates conceptual reasoning from language generation, suggesting a scalable direction for more stable multi-turn systems.",2025-12-10 01:08:06+00:00,"['cs.CL', 'cs.AI']",https://arxiv.org/pdf/2512.09222v1
MPC for momentum counter-balanced and zero-impulse contact with a free-spinning satellite,"In on-orbit robotics, a servicer satellite's ability to make contact with a free-spinning target satellite is essential to completing most on-orbit servicing (OOS) tasks. This manuscript develops a nonlinear model predictive control (MPC) framework that generates feasible controls for a servicer satellite to achieve zero-impulse contact with a free-spinning target satellite. The overall maneuver requires coordination between two separately actuated modules of the servicer satellite: (1) a moment generation module and (2) a manipulation module. We apply MPC to control both modules by explicitly modeling the cross-coupling dynamics between them. We demonstrate that the MPC controller can enforce actuation and state constraints that prior control approaches could not account for. We evaluate the performance of the MPC controller by simulating zero-impulse contact scenarios with a free-spinning target satellite via numerical Monte Carlo (MC) trials and comparing the simulation results with prior control approaches. Our simulation results validate the effectiveness of the MPC controller in maintaining spin synchronization and zero-impulse contact under operation constraints, moving contact location, and observation and actuation noise.",2025-12-10 00:53:10+00:00,"['eess.SY', 'cs.RO']",https://arxiv.org/pdf/2512.09213v1
Tensor-Compressed and Fully-Quantized Training of Neural PDE Solvers,"Physics-Informed Neural Networks (PINNs) have emerged as a promising paradigm for solving partial differential equations (PDEs) by embedding physical laws into neural network training objectives. However, their deployment on resource-constrained platforms is hindered by substantial computational and memory overhead, primarily stemming from higher-order automatic differentiation, intensive tensor operations, and reliance on full-precision arithmetic. To address these challenges, we present a framework that enables scalable and energy-efficient PINN training on edge devices. This framework integrates fully quantized training, Stein's estimator (SE)-based residual loss computation, and tensor-train (TT) decomposition for weight compression. It contributes three key innovations: (1) a mixed-precision training method that use a square-block MX (SMX) format to eliminate data duplication during backpropagation; (2) a difference-based quantization scheme for the Stein's estimator that mitigates underflow; and (3) a partial-reconstruction scheme (PRS) for TT-Layers that reduces quantization-error accumulation. We further design PINTA, a precision-scalable hardware accelerator, to fully exploit the performance of the framework. Experiments on the 2-D Poisson, 20-D Hamilton-Jacobi-Bellman (HJB), and 100-D Heat equations demonstrate that the proposed framework achieves accuracy comparable to or better than full-precision, uncompressed baselines while delivering 5.5x to 83.5x speedups and 159.6x to 2324.1x energy savings. This work enables real-time PDE solving on edge devices and paves the way for energy-efficient scientific computing at scale.",2025-12-10 00:00:34+00:00,"['cs.LG', 'cs.AI', 'cs.AR']",https://arxiv.org/pdf/2512.09202v1
LLMs for Analog Circuit Design Continuum (ACDC),"Large Language Models (LLMs) and transformer architectures have shown impressive reasoning and generation capabilities across diverse natural language tasks. However, their reliability and robustness in real-world engineering domains remain largely unexplored, limiting their practical utility in human-centric workflows. In this work, we investigate the applicability and consistency of LLMs for analog circuit design -- a task requiring domain-specific reasoning, adherence to physical constraints, and structured representations -- focusing on AI-assisted design where humans remain in the loop. We study how different data representations influence model behavior and compare smaller models (e.g., T5, GPT-2) with larger foundation models (e.g., Mistral-7B, GPT-oss-20B) under varying training conditions. Our results highlight key reliability challenges, including sensitivity to data format, instability in generated designs, and limited generalization to unseen circuit configurations. These findings provide early evidence on the limits and potential of LLMs as tools to enhance human capabilities in complex engineering tasks, offering insights into designing reliable, deployable foundation models for structured, real-world applications.",2025-12-09 23:57:28+00:00,"['cs.LG', 'cs.AI', 'cs.PF']",https://arxiv.org/pdf/2512.09199v1
Towards Optimal Valve Prescription for Transcatheter Aortic Valve Replacement (TAVR) Surgery: A Machine Learning Approach,"Transcatheter Aortic Valve Replacement (TAVR) has emerged as a minimally invasive treatment option for patients with severe aortic stenosis, a life-threatening cardiovascular condition. Multiple transcatheter heart valves (THV) have been approved for use in TAVR, but current guidelines regarding valve type prescription remain an active topic of debate. We propose a data-driven clinical support tool to identify the optimal valve type with the objective of minimizing the risk of permanent pacemaker implantation (PPI), a predominant postoperative complication. We synthesize a novel dataset that combines U.S. and Greek patient populations and integrates three distinct data sources (patient demographics, computed tomography scans, echocardiograms) while harmonizing differences in each country's record system. We introduce a leaf-level analysis to leverage population heterogeneity and avoid benchmarking against uncertain counterfactual risk estimates. The final prescriptive model shows a reduction in PPI rates of 26% and 16% compared with the current standard of care in our internal U.S. population and external Greek validation cohort, respectively. To the best of our knowledge, this work represents the first unified, personalized prescription strategy for THV selection in TAVR.",2025-12-09 23:46:46+00:00,"['cs.LG', 'cs.AI']",https://arxiv.org/pdf/2512.09198v1
Understanding Mental States in Active and Autonomous Driving with EEG,"Understanding how driver mental states differ between active and autonomous driving is critical for designing safe human-vehicle interfaces. This paper presents the first EEG-based comparison of cognitive load, fatigue, valence, and arousal across the two driving modes. Using data from 31 participants performing identical tasks in both scenarios of three different complexity levels, we analyze temporal patterns, task-complexity effects, and channel-wise activation differences. Our findings show that although both modes evoke similar trends across complexity levels, the intensity of mental states and the underlying neural activation differ substantially, indicating a clear distribution shift between active and autonomous driving. Transfer-learning experiments confirm that models trained on active driving data generalize poorly to autonomous driving and vice versa. We attribute this distribution shift primarily to differences in motor engagement and attentional demands between the two driving modes, which lead to distinct spatial and temporal EEG activation patterns. Although autonomous driving results in lower overall cortical activation, participants continue to exhibit measurable fluctuations in cognitive load, fatigue, valence, and arousal associated with readiness to intervene, task-evoked emotional responses, and monotony-related passive fatigue. These results emphasize the need for scenario-specific data and models when developing next-generation driver monitoring systems for autonomous vehicles.",2025-12-09 23:30:52+00:00,"['cs.HC', 'cs.AI']",https://arxiv.org/pdf/2512.09190v1
