title,abstract,published,categories,pdf_url
Using reinforcement learning to probe the role of feedback in skill acquisition,"Many high-performance human activities are executed with little or no external feedback: think of a figure skater landing a triple jump, a pitcher throwing a curveball for a strike, or a barista pouring latte art. To study the process of skill acquisition under fully controlled conditions, we bypass human subjects. Instead, we directly interface a generalist reinforcement learning agent with a spinning cylinder in a tabletop circulating water channel to maximize or minimize drag. This setup has several desirable properties. First, it is a physical system, with the rich interactions and complex dynamics that only the physical world has: the flow is highly chaotic and extremely difficult, if not impossible, to model or simulate accurately. Second, the objective -- drag minimization or maximization -- is easy to state and can be captured directly in the reward, yet good strategies are not obvious beforehand. Third, decades-old experimental studies provide recipes for simple, high-performance open-loop policies. Finally, the setup is inexpensive and far easier to reproduce than human studies. In our experiments we find that high-dimensional flow feedback lets the agent discover high-performance drag-control strategies with only minutes of real-world interaction. When we later replay the same action sequences without any feedback, we obtain almost identical performance. This shows that feedback, and in particular flow feedback, is not needed to execute the learned policy. Surprisingly, without flow feedback during training the agent fails to discover any well-performing policy in drag maximization, but still succeeds in drag minimization, albeit more slowly and less reliably. Our studies show that learning a high-performance skill can require richer information than executing it, and learning conditions can be kind or wicked depending solely on the goal, not on dynamics or policy complexity.",2025-12-09 10:37:42+00:00,"['cs.AI', 'cs.LG', 'cs.RO', 'eess.SY']",https://arxiv.org/pdf/2512.08463v1
Biothreat Benchmark Generation Framework for Evaluating Frontier AI Models III: Implementing the Bacterial Biothreat Benchmark (B3) Dataset,"The potential for rapidly-evolving frontier artificial intelligence (AI) models, especially large language models (LLMs), to facilitate bioterrorism or access to biological weapons has generated significant policy, academic, and public concern. Both model developers and policymakers seek to quantify and mitigate any risk, with an important element of such efforts being the development of model benchmarks that can assess the biosecurity risk posed by a particular model. This paper discusses the pilot implementation of the Bacterial Biothreat Benchmark (B3) dataset. It is the third in a series of three papers describing an overall Biothreat Benchmark Generation (BBG) framework, with previous papers detailing the development of the B3 dataset. The pilot involved running the benchmarks through a sample frontier AI model, followed by human evaluation of model responses, and an applied risk analysis of the results along several dimensions. Overall, the pilot demonstrated that the B3 dataset offers a viable, nuanced method for rapidly assessing the biosecurity risk posed by a LLM, identifying the key sources of that risk and providing guidance for priority areas of mitigation priority.",2025-12-09 10:31:02+00:00,"['cs.LG', 'cs.AI', 'cs.CY', 'cs.ET']",https://arxiv.org/pdf/2512.08459v1
Biothreat Benchmark Generation Framework for Evaluating Frontier AI Models II: Benchmark Generation Process,"The potential for rapidly-evolving frontier artificial intelligence (AI) models, especially large language models (LLMs), to facilitate bioterrorism or access to biological weapons has generated significant policy, academic, and public concern. Both model developers and policymakers seek to quantify and mitigate any risk, with an important element of such efforts being the development of model benchmarks that can assess the biosecurity risk posed by a particular model. This paper, the second in a series of three, describes the second component of a novel Biothreat Benchmark Generation (BBG) framework: the generation of the Bacterial Biothreat Benchmark (B3) dataset. The development process involved three complementary approaches: 1) web-based prompt generation, 2) red teaming, and 3) mining existing benchmark corpora, to generate over 7,000 potential benchmarks linked to the Task-Query Architecture that was developed during the first component of the project. A process of de-duplication, followed by an assessment of uplift diagnosticity, and general quality control measures, reduced the candidates to a set of 1,010 final benchmarks. This procedure ensured that these benchmarks are a) diagnostic in terms of providing uplift; b) directly relevant to biosecurity threats; and c) are aligned with a larger biosecurity architecture permitting nuanced analysis at different levels of analysis.",2025-12-09 10:24:25+00:00,"['cs.LG', 'cs.AI', 'cs.CY', 'cs.ET']",https://arxiv.org/pdf/2512.08451v1
From Accuracy to Impact: The Impact-Driven AI Framework (IDAIF) for Aligning Engineering Architecture with Theory of Change,"This paper introduces the Impact-Driven AI Framework (IDAIF), a novel architectural methodology that integrates Theory of Change (ToC) principles with modern artificial intelligence system design. As AI systems increasingly influence high-stakes domains including healthcare, finance, and public policy, the alignment problem--ensuring AI behavior corresponds with human values and intentions--has become critical. Current approaches predominantly optimize technical performance metrics while neglecting the sociotechnical dimensions of AI deployment. IDAIF addresses this gap by establishing a systematic mapping between ToC's five-stage model (Inputs-Activities-Outputs-Outcomes-Impact) and corresponding AI architectural layers (Data Layer-Pipeline Layer-Inference Layer-Agentic Layer-Normative Layer). Each layer incorporates rigorous theoretical foundations: multi-objective Pareto optimization for value alignment, hierarchical multi-agent orchestration for outcome achievement, causal directed acyclic graphs (DAGs) for hallucination mitigation, and adversarial debiasing with Reinforcement Learning from Human Feedback (RLHF) for fairness assurance. We provide formal mathematical formulations for each component and introduce an Assurance Layer that manages assumption failures through guardian architectures. Three case studies demonstrate IDAIF application across healthcare, cybersecurity, and software engineering domains. This framework represents a paradigm shift from model-centric to impact-centric AI development, providing engineers with concrete architectural patterns for building ethical, trustworthy, and socially beneficial AI systems.",2025-12-09 10:21:02+00:00,['cs.AI'],https://arxiv.org/pdf/2512.08449v1
SDT-6D: Fully Sparse Depth-Transformer for Staged End-to-End 6D Pose Estimation in Industrial Multi-View Bin Picking,"Accurately recovering 6D poses in densely packed industrial bin-picking environments remain a serious challenge, owing to occlusions, reflections, and textureless parts. We introduce a holistic depth-only 6D pose estimation approach that fuses multi-view depth maps into either a fine-grained 3D point cloud in its vanilla version, or a sparse Truncated Signed Distance Field (TSDF). At the core of our framework lies a staged heatmap mechanism that yields scene-adaptive attention priors across different resolutions, steering computation toward foreground regions, thus keeping memory requirements at high resolutions feasible. Along, we propose a density-aware sparse transformer block that dynamically attends to (self-) occlusions and the non-uniform distribution of 3D data. While sparse 3D approaches has proven effective for long-range perception, its potential in close-range robotic applications remains underexplored. Our framework operates fully sparse, enabling high-resolution volumetric representations to capture fine geometric details crucial for accurate pose estimation in clutter. Our method processes the entire scene integrally, predicting the 6D pose via a novel per-voxel voting strategy, allowing simultaneous pose predictions for an arbitrary number of target objects. We validate our method on the recently published IPD and MV-YCB multi-view datasets, demonstrating competitive performance in heavily cluttered industrial and household bin picking scenarios.",2025-12-09 09:58:35+00:00,"['cs.CV', 'cs.RO']",https://arxiv.org/pdf/2512.08430v1
Prismatic World Model: Learning Compositional Dynamics for Planning in Hybrid Systems,"Model-based planning in robotic domains is fundamentally challenged by the hybrid nature of physical dynamics, where continuous motion is punctuated by discrete events such as contacts and impacts. Conventional latent world models typically employ monolithic neural networks that enforce global continuity, inevitably over-smoothing the distinct dynamic modes (e.g., sticking vs. sliding, flight vs. stance). For a planner, this smoothing results in catastrophic compounding errors during long-horizon lookaheads, rendering the search process unreliable at physical boundaries. To address this, we introduce the Prismatic World Model (PRISM-WM), a structured architecture designed to decompose complex hybrid dynamics into composable primitives. PRISM-WM leverages a context-aware Mixture-of-Experts (MoE) framework where a gating mechanism implicitly identifies the current physical mode, and specialized experts predict the associated transition dynamics. We further introduce a latent orthogonalization objective to ensure expert diversity, effectively preventing mode collapse. By accurately modeling the sharp mode transitions in system dynamics, PRISM-WM significantly reduces rollout drift. Extensive experiments on challenging continuous control benchmarks, including high-dimensional humanoids and diverse multi-task settings, demonstrate that PRISM-WM provides a superior high-fidelity substrate for trajectory optimization algorithms (e.g., TD-MPC), proving its potential as a powerful foundational model for next-generation model-based agents.",2025-12-09 09:40:34+00:00,"['cs.AI', 'cs.RO']",https://arxiv.org/pdf/2512.08411v1
Learning Robot Manipulation from Audio World Models,"World models have demonstrated impressive performance on robotic learning tasks. Many such tasks inherently demand multimodal reasoning; for example, filling a bottle with water will lead to visual information alone being ambiguous or incomplete, thereby requiring reasoning over the temporal evolution of audio, accounting for its underlying physical properties and pitch patterns. In this paper, we propose a generative latent flow matching model to anticipate future audio observations, enabling the system to reason about long-term consequences when integrated into a robot policy. We demonstrate the superior capabilities of our system through two manipulation tasks that require perceiving in-the-wild audio or music signals, compared to methods without future lookahead. We further emphasize that successful robot action learning for these tasks relies not merely on multi-modal input, but critically on the accurate prediction of future audio states that embody intrinsic rhythmic patterns.",2025-12-09 09:36:51+00:00,['cs.RO'],https://arxiv.org/pdf/2512.08405v1
Are generative AI text annotations systematically biased?,"This paper investigates bias in GLLM annotations by conceptually replicating manual annotations of Boukes (2024). Using various GLLMs (Llama3.1:8b, Llama3.3:70b, GPT4o, Qwen2.5:72b) in combination with five different prompts for five concepts (political content, interactivity, rationality, incivility, and ideology). We find GLLMs perform adequate in terms of F1 scores, but differ from manual annotations in terms of prevalence, yield substantively different downstream results, and display systematic bias in that they overlap more with each other than with manual annotations. Differences in F1 scores fail to account for the degree of bias.",2025-12-09 09:36:43+00:00,"['cs.CL', 'cs.AI']",https://arxiv.org/pdf/2512.08404v1
DeepFeature: Iterative Context-aware Feature Generation for Wearable Biosignals,"Biosignals collected from wearable devices are widely utilized in healthcare applications. Machine learning models used in these applications often rely on features extracted from biosignals due to their effectiveness, lower data dimensionality, and wide compatibility across various model architectures. However, existing feature extraction methods often lack task-specific contextual knowledge, struggle to identify optimal feature extraction settings in high-dimensional feature space, and are prone to code generation and automation errors. In this paper, we propose DeepFeature, the first LLM-empowered, context-aware feature generation framework for wearable biosignals. DeepFeature introduces a multi-source feature generation mechanism that integrates expert knowledge with task settings. It also employs an iterative feature refinement process that uses feature assessment-based feedback for feature re-selection. Additionally, DeepFeature utilizes a robust multi-layer filtering and verification approach for robust feature-to-code translation to ensure that the extraction functions run without crashing. Experimental evaluation results show that DeepFeature achieves an average AUROC improvement of 4.21-9.67% across eight diverse tasks compared to baseline methods. It outperforms state-of-the-art approaches on five tasks while maintaining comparable performance on the remaining tasks.",2025-12-09 09:06:17+00:00,['cs.AI'],https://arxiv.org/pdf/2512.08379v1
Reflecting with Two Voices: A Co-Adaptive Dual-Strategy Framework for LLM-Based Agent Decision Making,"Large language model (LLM) agents often rely on external demonstrations or retrieval-augmented planning, leading to brittleness, poor generalization, and high computational overhead. Inspired by human problem-solving, we propose DuSAR (Dual-Strategy Agent with Reflecting) - a demonstration-free framework that enables a single frozen LLM to perform co-adaptive reasoning via two complementary strategies: a high-level holistic plan and a context-grounded local policy. These strategies interact through a lightweight reflection mechanism, where the agent continuously assesses progress via a Strategy Fitness Score and dynamically revises its global plan when stuck or refines it upon meaningful advancement, mimicking human metacognitive behavior. On ALFWorld and Mind2Web, DuSAR achieves state-of-the-art performance with open-source LLMs (7B-70B), reaching 37.1% success on ALFWorld (Llama3.1-70B) - more than doubling the best prior result (13.0%) - and 4.02% on Mind2Web, also more than doubling the strongest baseline. Remarkably, it reduces per-step token consumption by 3-9X while maintaining strong performance. Ablation studies confirm the necessity of dual-strategy coordination. Moreover, optional integration of expert demonstrations further boosts results, highlighting DuSAR's flexibility and compatibility with external knowledge.",2025-12-09 08:44:59+00:00,['cs.AI'],https://arxiv.org/pdf/2512.08366v1
Conditional Morphogenesis: Emergent Generation of Structural Digits via Neural Cellular Automata,"Biological systems exhibit remarkable morphogenetic plasticity, where a single genome can encode various specialized cellular structures triggered by local chemical signals. In the domain of Deep Learning, Differentiable Neural Cellular Automata (NCA) have emerged as a paradigm to mimic this self-organization. However, existing NCA research has predominantly focused on continuous texture synthesis or single-target object recovery, leaving the challenge of class-conditional structural generation largely unexplored. In this work, we propose a novel Conditional Neural Cellular Automata (c-NCA) architecture capable of growing distinct topological structures - specifically MNIST digits - from a single generic seed, guided solely by a spatially broadcasted class vector. Unlike traditional generative models (e.g., GANs, VAEs) that rely on global reception fields, our model enforces strict locality and translation equivariance. We demonstrate that by injecting a one-hot condition into the cellular perception field, a single set of local rules can learn to break symmetry and self-assemble into ten distinct geometric attractors. Experimental results show that our c-NCA achieves stable convergence, correctly forming digit topologies from a single pixel, and exhibits robustness characteristic of biological systems. This work bridges the gap between texture-based NCAs and structural pattern formation, offering a lightweight, biologically plausible alternative for conditional generation.",2025-12-09 08:36:54+00:00,"['cs.NE', 'cs.AI', 'cs.CV', 'cs.LG']",https://arxiv.org/pdf/2512.08360v1
The High Cost of Incivility: Quantifying Interaction Inefficiency via Multi-Agent Monte Carlo Simulations,"Workplace toxicity is widely recognized as detrimental to organizational culture, yet quantifying its direct impact on operational efficiency remains methodologically challenging due to the ethical and practical difficulties of reproducing conflict in human subjects. This study leverages Large Language Model (LLM) based Multi-Agent Systems to simulate 1-on-1 adversarial debates, creating a controlled ""sociological sandbox"". We employ a Monte Carlo method to simulate hundrets of discussions, measuring the convergence time (defined as the number of arguments required to reach a conclusion) between a baseline control group and treatment groups involving agents with ""toxic"" system prompts. Our results demonstrate a statistically significant increase of approximately 25\% in the duration of conversations involving toxic participants. We propose that this ""latency of toxicity"" serves as a proxy for financial damage in corporate and academic settings. Furthermore, we demonstrate that agent-based modeling provides a reproducible, ethical alternative to human-subject research for measuring the mechanics of social friction.",2025-12-09 08:17:35+00:00,"['cs.AI', 'cs.CL', 'cs.CY', 'cs.MA']",https://arxiv.org/pdf/2512.08345v1
Enhancing Explainability of Graph Neural Networks Through Conceptual and Structural Analyses and Their Extensions,"Graph Neural Networks (GNNs) have become a powerful tool for modeling and analyzing data with graph structures. The wide adoption in numerous applications underscores the value of these models. However, the complexity of these methods often impedes understanding their decision-making processes. Current Explainable AI (XAI) methods struggle to untangle the intricate relationships and interactions within graphs. Several methods have tried to bridge this gap via a post-hoc approach or self-interpretable design. Most of them focus on graph structure analysis to determine essential patterns that correlate with prediction outcomes. While post-hoc explanation methods are adaptable, they require extra computational resources and may be less reliable due to limited access to the model's internal workings. Conversely, Interpretable models can provide immediate explanations, but their generalizability to different scenarios remains a major concern. To address these shortcomings, this thesis seeks to develop a novel XAI framework tailored for graph-based machine learning. The proposed framework aims to offer adaptable, computationally efficient explanations for GNNs, moving beyond individual feature analysis to capture how graph structure influences predictions.",2025-12-09 08:13:31+00:00,"['cs.AI', 'cs.IT', 'cs.LG']",https://arxiv.org/pdf/2512.08344v1
Soil Compaction Parameters Prediction Based on Automated Machine Learning Approach,"Soil compaction is critical in construction engineering to ensure the stability of structures like road embankments and earth dams. Traditional methods for determining optimum moisture content (OMC) and maximum dry density (MDD) involve labor-intensive laboratory experiments, and empirical regression models have limited applicability and accuracy across diverse soil types. In recent years, artificial intelligence (AI) and machine learning (ML) techniques have emerged as alternatives for predicting these compaction parameters. However, ML models often struggle with prediction accuracy and generalizability, particularly with heterogeneous datasets representing various soil types. This study proposes an automated machine learning (AutoML) approach to predict OMC and MDD. AutoML automates algorithm selection and hyperparameter optimization, potentially improving accuracy and scalability. Through extensive experimentation, the study found that the Extreme Gradient Boosting (XGBoost) algorithm provided the best performance, achieving R-squared values of 80.4% for MDD and 89.1% for OMC on a separate dataset. These results demonstrate the effectiveness of AutoML in predicting compaction parameters across different soil types. The study also highlights the importance of heterogeneous datasets in improving the generalization and performance of ML models. Ultimately, this research contributes to more efficient and reliable construction practices by enhancing the prediction of soil compaction parameters.",2025-12-09 08:13:04+00:00,['cs.AI'],https://arxiv.org/pdf/2512.08343v1
Predicting California Bearing Ratio with Ensemble and Neural Network Models: A Case Study from Türkiye,"The California Bearing Ratio (CBR) is a key geotechnical indicator used to assess the load-bearing capacity of subgrade soils, especially in transportation infrastructure and foundation design. Traditional CBR determination relies on laboratory penetration tests. Despite their accuracy, these tests are often time-consuming, costly, and can be impractical, particularly for large-scale or diverse soil profiles. Recent progress in artificial intelligence, especially machine learning (ML), has enabled data-driven approaches for modeling complex soil behavior with greater speed and precision. This study introduces a comprehensive ML framework for CBR prediction using a dataset of 382 soil samples collected from various geoclimatic regions in Türkiye. The dataset includes physicochemical soil properties relevant to bearing capacity, allowing multidimensional feature representation in a supervised learning context. Twelve ML algorithms were tested, including decision tree, random forest, extra trees, gradient boosting, xgboost, k-nearest neighbors, support vector regression, multi-layer perceptron, adaboost, bagging, voting, and stacking regressors. Each model was trained, validated, and evaluated to assess its generalization and robustness. Among them, the random forest regressor performed the best, achieving strong R2 scores of 0.95 (training), 0.76 (validation), and 0.83 (test). These outcomes highlight the model's powerful nonlinear mapping ability, making it a promising tool for predictive geotechnical tasks. The study supports the integration of intelligent, data-centric models in geotechnical engineering, offering an effective alternative to traditional methods and promoting digital transformation in infrastructure analysis and design.",2025-12-09 08:09:55+00:00,"['cs.AI', 'cs.LG']",https://arxiv.org/pdf/2512.08340v1
Robust Finetuning of Vision-Language-Action Robot Policies via Parameter Merging,"Generalist robot policies, trained on large and diverse datasets, have demonstrated the ability to generalize across a wide spectrum of behaviors, enabling a single policy to act in varied real-world environments. However, they still fall short on new tasks not covered in the training data. When finetuned on limited demonstrations of a new task, these policies often overfit to the specific demonstrations--not only losing their prior abilities to solve a wide variety of generalist tasks but also failing to generalize within the new task itself. In this work, we aim to develop a method that preserves the generalization capabilities of the generalist policy during finetuning, allowing a single policy to robustly incorporate a new skill into its repertoire. Our goal is a single policy that both learns to generalize to variations of the new task and retains the broad competencies gained from pretraining. We show that this can be achieved through a simple yet effective strategy: interpolating the weights of a finetuned model with that of the pretrained model. We show, across extensive simulated and real-world experiments, that such model merging produces a single model that inherits the generalist abilities of the base model and learns to solve the new task robustly, outperforming both the pretrained and finetuned model on out-of-distribution variations of the new task. Moreover, we show that model merging enables continual acquisition of new skills in a lifelong learning setting, without sacrificing previously learned generalist abilities.",2025-12-09 08:02:11+00:00,"['cs.RO', 'cs.AI']",https://arxiv.org/pdf/2512.08333v1
