title,abstract,published,categories,pdf_url
Universal Hirschberg for Width Bounded Dynamic Programs,"Hirschberg's algorithm (1975) reduces the space complexity for the longest common subsequence problem from $O(N^2)$ to $O(N)$ via recursive midpoint bisection on a grid dynamic program (DP). We show that the underlying idea generalizes to a broad class of dynamic programs with local dependencies on directed acyclic graphs (DP DAGs). Modeling a DP as deterministic time evolution over a topologically ordered DAG with frontier width $ω$ and bounded in-degree, and assuming a max-type semiring with deterministic tie breaking, we prove that in a standard offline random-access model any such DP admits deterministic traceback in space $O(ω\log T + (\log T)^{O(1)})$ cells over a fixed finite alphabet, where $T$ is the number of states. Our construction replaces backward dynamic programs by forward-only recomputation and organizes the time order into a height-compressed recursion tree whose nodes expose small ""middle frontiers'' across which every optimal path must pass. The framework yields near-optimal traceback bounds for asymmetric and banded sequence alignment, one-dimensional recurrences, and dynamic-programming formulations on graphs of bounded pathwidth. We also show that an $Ω(ω)$ space term (in bits) is unavoidable in forward single-pass models and discuss conjectured $\sqrt{T}$-type barriers in streaming settings, supporting the view that space-efficient traceback is a structural property of width-bounded DP DAGs rather than a peculiarity of grid-based algorithms.",2025-12-10 22:26:22+00:00,"['cs.DS', 'cs.AI']",https://arxiv.org/pdf/2512.10132v1
Inertial Magnetic SLAM Systems Using Low-Cost Sensors,"Spatially inhomogeneous magnetic fields offer a valuable, non-visual information source for positioning. Among systems leveraging this, magnetic field-based simultaneous localization and mapping (SLAM) systems are particularly attractive because they can provide positioning information and build a magnetic field map on the fly. Moreover, they have bounded error within mapped regions. However, state-of-the-art methods typically require low-drift odometry data provided by visual odometry or a wheel encoder, etc. This is because these systems need to minimize/reduce positioning errors while exploring, which happens when they are in unmapped regions. To address these limitations, this work proposes a loosely coupled and a tightly coupled inertial magnetic SLAM (IM-SLAM) system. The proposed systems use commonly available low-cost sensors: an inertial measurement unit (IMU), a magnetometer array, and a barometer. The use of non-visual data provides a significant advantage over visual-based systems, making it robust to low-visibility conditions. Both systems employ state-space representations, and magnetic field models on different scales. The difference lies in how they use a local and global magnetic field model. The loosely coupled system uses these models separately in two state-space models, while the tightly coupled system integrates them into one state-space model. Experiment results show that the tightly coupled IM-SLAM system achieves lower positioning errors than the loosely coupled system in most scenarios, with typical errors on the order of meters per 100 meters traveled. These results demonstrate the feasiblity of developing a full 3D IM-SLAM systems using low-cost sensors and the potential of applying these systems in emergency response scenarios such as mine/fire rescue.",2025-12-10 22:22:00+00:00,"['cs.RO', 'eess.SP']",https://arxiv.org/pdf/2512.10128v1
"Workflow is All You Need: Escaping the ""Statistical Smoothing Trap"" via High-Entropy Information Foraging and Adversarial Pacing","Central to long-form text generation in vertical domains is the ""impossible trinity"" confronting current large language models (LLMs): the simultaneous achievement of low hallucination, deep logical coherence, and personalized expression. This study establishes that this bottleneck arises from existing generative paradigms succumbing to the Statistical Smoothing Trap, a phenomenon that overlooks the high-entropy information acquisition and structured cognitive processes integral to expert-level writing. To address this limitation, we propose the DeepNews Framework, an agentic workflow that explicitly models the implicit cognitive processes of seasoned financial journalists. The framework integrates three core modules: first, a dual-granularity retrieval mechanism grounded in information foraging theory, which enforces a 10:1 saturated information input ratio to mitigate hallucinatory outputs; second, schema-guided strategic planning, a process leveraging domain expert knowledge bases (narrative schemas) and Atomic Blocks to forge a robust logical skeleton; third, adversarial constraint prompting, a technique deploying tactics including Rhythm Break and Logic Fog to disrupt the probabilistic smoothness inherent in model-generated text. Experiments delineate a salient Knowledge Cliff in deep financial reporting: content truthfulness collapses when retrieved context falls below 15,000 characters, while a high-redundancy input exceeding 30,000 characters stabilizes the Hallucination-Free Rate (HFR) above 85%. In an ecological validity blind test conducted with a top-tier Chinese technology media outlet, the DeepNews system--built on a previous-generation model (DeepSeek-V3-0324)-achieved a 25% submission acceptance rate, significantly outperforming the 0% acceptance rate of zero-shot generation by a state-of-the-art (SOTA) model (GPT-5).",2025-12-10 22:13:55+00:00,"['cs.CL', 'cs.AI', 'cs.CY', 'q-fin.GN']",https://arxiv.org/pdf/2512.10121v1
VocSim: A Training-free Benchmark for Zero-shot Content Identity in Single-source Audio,"General-purpose audio representations aim to map acoustically variable instances of the same event to nearby points, resolving content identity in a zero-shot setting. Unlike supervised classification benchmarks that measure adaptability via parameter updates, we introduce VocSim, a training-free benchmark probing the intrinsic geometric alignment of frozen embeddings. VocSim aggregates 125k single-source clips from 19 corpora spanning human speech, animal vocalizations, and environmental sounds. By restricting to single-source audio, we isolate content representation from the confound of source separation. We evaluate embeddings using Precision@k for local purity and the Global Separation Rate (GSR) for point-wise class separation. To calibrate GSR, we report lift over an empirical permutation baseline. Across diverse foundation models, a simple pipeline, frozen Whisper encoder features, time-frequency pooling, and label-free PCA, yields strong zero-shot performance. However, VocSim also uncovers a consistent generalization gap. On blind, low-resource speech, local retrieval drops sharply. While performance remains statistically distinguishable from chance, the absolute geometric structure collapses, indicating a failure to generalize to unseen phonotactics. As external validation, our top embeddings predict avian perceptual similarity, improve bioacoustic classification, and achieve state-of-the-art results on the HEAR benchmark. We posit that the intrinsic geometric quality measured here proxies utility in unlisted downstream applications. We release data, code, and a public leaderboard to standardize the evaluation of intrinsic audio geometry.",2025-12-10 22:13:12+00:00,"['cs.SD', 'cs.AI']",https://arxiv.org/pdf/2512.10120v1
CHyLL: Learning Continuous Neural Representations of Hybrid Systems,"Learning the flows of hybrid systems that have both continuous and discrete time dynamics is challenging. The existing method learns the dynamics in each discrete mode, which suffers from the combination of mode switching and discontinuities in the flows. In this work, we propose CHyLL (Continuous Hybrid System Learning in Latent Space), which learns a continuous neural representation of a hybrid system without trajectory segmentation, event functions, or mode switching. The key insight of CHyLL is that the reset map glues the state space at the guard surface, reformulating the state space as a piecewise smooth quotient manifold where the flow becomes spatially continuous. Building upon these insights and the embedding theorems grounded in differential topology, CHyLL concurrently learns a singularity-free neural embedding in a higher-dimensional space and the continuous flow in it. We showcase that CHyLL can accurately predict the flow of hybrid systems with superior accuracy and identify the topological invariants of the hybrid systems. Finally, we apply CHyLL to the stochastic optimal control problem.",2025-12-10 22:07:16+00:00,"['cs.LG', 'cs.AI', 'cs.RO', 'eess.SP', 'eess.SY']",https://arxiv.org/pdf/2512.10117v1
Fast Functionally Redundant Inverse Kinematics for Robotic Toolpath Optimisation in Manufacturing Tasks,"Industrial automation with six-axis robotic arms is critical for many manufacturing tasks, including welding and additive manufacturing applications; however, many of these operations are functionally redundant due to the symmetrical tool axis, which effectively makes the operation a five-axis task. Exploiting this redundancy is crucial for achieving the desired workspace and dexterity required for the feasibility and optimisation of toolpath planning. Inverse kinematics algorithms can solve this in a fast, reactive framework, but these techniques are underutilised over the more computationally expensive offline planning methods. We propose a novel algorithm to solve functionally redundant inverse kinematics for robotic manipulation utilising a task space decomposition approach, the damped least-squares method and Halley's method to achieve fast and robust solutions with reduced joint motion. We evaluate our methodology in the case of toolpath optimisation in a cold spray coating application on a non-planar surface. The functionally redundant inverse kinematics algorithm can quickly solve motion plans that minimise joint motion, expanding the feasible operating space of the complex toolpath. We validate our approach on an industrial ABB manipulator and cold-spray gun executing the computed toolpath.",2025-12-10 22:07:07+00:00,['cs.RO'],https://arxiv.org/pdf/2512.10116v1
AgriRegion: Region-Aware Retrieval for High-Fidelity Agricultural Advice,"Large Language Models (LLMs) have demonstrated significant potential in democratizing access to information. However, in the domain of agriculture, general-purpose models frequently suffer from contextual hallucination, which provides non-factual advice or answers are scientifically sound in one region but disastrous in another due to variations in soil, climate, and local regulations. We introduce AgriRegion, a Retrieval-Augmented Generation (RAG) framework designed specifically for high-fidelity, region-aware agricultural advisory. Unlike standard RAG approaches that rely solely on semantic similarity, AgriRegion incorporates a geospatial metadata injection layer and a region-prioritized re-ranking mechanism. By restricting the knowledge base to verified local agricultural extension services and enforcing geo-spatial constraints during retrieval, AgriRegion ensures that the advice regarding planting schedules, pest control, and fertilization is locally accurate. We create a novel benchmark dataset, AgriRegion-Eval, which comprises 160 domain-specific questions across 12 agricultural subfields. Experiments demonstrate that AgriRegion reduces hallucinations by 10-20% compared to state-of-the-art LLMs systems and significantly improves trust scores according to a comprehensive evaluation.",2025-12-10 22:06:41+00:00,['cs.AI'],https://arxiv.org/pdf/2512.10114v1
Modeling Narrative Archetypes in Conspiratorial Narratives: Insights from Singapore-Based Telegram Groups,"Conspiratorial discourse is increasingly embedded within digital communication ecosystems, yet its structure and spread remain difficult to study. This work analyzes conspiratorial narratives in Singapore-based Telegram groups, showing that such content is woven into everyday discussions rather than confined to isolated echo chambers. We propose a two-stage computational framework. First, we fine-tune RoBERTa-large to classify messages as conspiratorial or not, achieving an F1-score of 0.866 on 2,000 expert-labeled messages. Second, we build a signed belief graph in which nodes represent messages and edge signs reflect alignment in belief labels, weighted by textual similarity. We introduce a Signed Belief Graph Neural Network (SiBeGNN) that uses a Sign Disentanglement Loss to learn embeddings that separate ideological alignment from stylistic features.
  Using hierarchical clustering on these embeddings, we identify seven narrative archetypes across 553,648 messages: legal topics, medical concerns, media discussions, finance, contradictions in authority, group moderation, and general chat. SiBeGNN yields stronger clustering quality (cDBI = 8.38) than baseline methods (13.60 to 67.27), supported by 88 percent inter-rater agreement in expert evaluations. Our analysis shows that conspiratorial messages appear not only in clusters focused on skepticism or distrust, but also within routine discussions of finance, law, and everyday matters. These findings challenge common assumptions about online radicalization by demonstrating that conspiratorial discourse operates within ordinary social interaction. The proposed framework advances computational methods for belief-driven discourse analysis and offers applications for stance detection, political communication studies, and content moderation policy.",2025-12-10 21:51:16+00:00,['cs.AI'],https://arxiv.org/pdf/2512.10105v1
Robust AI Security and Alignment: A Sisyphean Endeavor?,This manuscript establishes information-theoretic limitations for robustness of AI security and alignment by extending Gödel's incompleteness theorem to AI. Knowing these limitations and preparing for the challenges they bring is critically important for the responsible adoption of the AI technology. Practical approaches to dealing with these challenges are provided as well. Broader implications for cognitive reasoning limitations of AI systems are also proven.,2025-12-10 21:44:10+00:00,['cs.AI'],https://arxiv.org/pdf/2512.10100v1
"Push Smarter, Not Harder: Hierarchical RL-Diffusion Policy for Efficient Nonprehensile Manipulation","Nonprehensile manipulation, such as pushing objects across cluttered environments, presents a challenging control problem due to complex contact dynamics and long-horizon planning requirements. In this work, we propose HeRD, a hierarchical reinforcement learning-diffusion policy that decomposes pushing tasks into two levels: high-level goal selection and low-level trajectory generation. We employ a high-level reinforcement learning (RL) agent to select intermediate spatial goals, and a low-level goal-conditioned diffusion model to generate feasible, efficient trajectories to reach them.
  This architecture combines the long-term reward maximizing behaviour of RL with the generative capabilities of diffusion models. We evaluate our method in a 2D simulation environment and show that it outperforms the state-of-the-art baseline in success rate, path efficiency, and generalization across multiple environment configurations. Our results suggest that hierarchical control with generative low-level planning is a promising direction for scalable, goal-directed nonprehensile manipulation. Code, documentation, and trained models are available: https://github.com/carosteven/HeRD.",2025-12-10 21:40:22+00:00,"['cs.RO', 'cs.LG']",https://arxiv.org/pdf/2512.10099v1
MedXAI: A Retrieval-Augmented and Self-Verifying Framework for Knowledge-Guided Medical Image Analysis,"Accurate and interpretable image-based diagnosis remains a fundamental challenge in medical AI, particularly under domain shifts and rare-class conditions. Deep learning models often struggle with real-world distribution changes, exhibit bias against infrequent pathologies, and lack the transparency required for deployment in safety-critical clinical environments. We introduce MedXAI (An Explainable Framework for Medical Imaging Classification), a unified expert knowledge based framework that integrates deep vision models with clinician-derived expert knowledge to improve generalization, reduce rare-class bias, and provide human-understandable explanations by localizing the relevant diagnostic features rather than relying on technical post-hoc methods (e.g., Saliency Maps, LIME). We evaluate MedXAI across heterogeneous modalities on two challenging tasks: (i) Seizure Onset Zone localization from resting-state fMRI, and (ii) Diabetic Retinopathy grading. Ex periments on ten multicenter datasets show consistent gains, including a 3% improvement in cross-domain generalization and a 10% improvmnet in F1 score of rare class, substantially outperforming strong deep learning baselines. Ablations confirm that the symbolic components act as effective clinical priors and regularizers, improving robustness under distribution shift. MedXAI delivers clinically aligned explanations while achieving superior in-domain and cross-domain performance, particularly for rare diseases in multimodal medical AI.",2025-12-10 21:40:04+00:00,"['cs.LG', 'cs.AI']",https://arxiv.org/pdf/2512.10098v1
Interpretable Embeddings with Sparse Autoencoders: A Data Analysis Toolkit,"Analyzing large-scale text corpora is a core challenge in machine learning, crucial for tasks like identifying undesirable model behaviors or biases in training data. Current methods often rely on costly LLM-based techniques (e.g. annotating dataset differences) or dense embedding models (e.g. for clustering), which lack control over the properties of interest. We propose using sparse autoencoders (SAEs) to create SAE embeddings: representations whose dimensions map to interpretable concepts. Through four data analysis tasks, we show that SAE embeddings are more cost-effective and reliable than LLMs and more controllable than dense embeddings. Using the large hypothesis space of SAEs, we can uncover insights such as (1) semantic differences between datasets and (2) unexpected concept correlations in documents. For instance, by comparing model responses, we find that Grok-4 clarifies ambiguities more often than nine other frontier models. Relative to LLMs, SAE embeddings uncover bigger differences at 2-8x lower cost and identify biases more reliably. Additionally, SAE embeddings are controllable: by filtering concepts, we can (3) cluster documents along axes of interest and (4) outperform dense embeddings on property-based retrieval. Using SAE embeddings, we study model behavior with two case studies: investigating how OpenAI model behavior has changed over time and finding ""trigger"" phrases learned by Tulu-3 (Lambert et al., 2024) from its training data. These results position SAEs as a versatile tool for unstructured data analysis and highlight the neglected importance of interpreting models through their data.",2025-12-10 21:26:24+00:00,"['cs.AI', 'cs.LG']",https://arxiv.org/pdf/2512.10092v1
Defining the Scope of Learning Analytics: An Axiomatic Approach for Analytic Practice and Measurable Learning Phenomena,"Learning Analytics (LA) has rapidly expanded through practical and technological innovation, yet its foundational identity has remained theoretically under-specified. This paper addresses this gap by proposing the first axiomatic theory that formally defines the essential structure, scope, and limitations of LA. Derived from the psychological definition of learning and the methodological requirements of LA, the framework consists of five axioms specifying discrete observation, experience construction, state transition, and inference. From these axioms, we derive a set of theorems and propositions that clarify the epistemological stance of LA, including the inherent unobservability of learner states, the irreducibility of temporal order, constraints on reachable states, and the impossibility of deterministically predicting future learning. We further define LA structure and LA practice as formal objects, demonstrating the sufficiency and necessity of the axioms and showing that diverse LA approaches -- such as Bayesian Knowledge Tracing and dashboards -- can be uniformly explained within this framework. The theory provides guiding principles for designing analytic methods and interpreting learning data while avoiding naive behaviorism and category errors by establishing an explicit theoretical inference layer between observations and states. This work positions LA as a rigorous science of state transition systems based on observability, establishing the theoretical foundation necessary for the field's maturation as a scholarly discipline.",2025-12-10 21:07:19+00:00,"['cs.CY', 'cs.AI', 'stat.ML']",https://arxiv.org/pdf/2512.10081v1
What Kind of Reasoning (if any) is an LLM actually doing? On the Stochastic Nature and Abductive Appearance of Large Language Models,"This article looks at how reasoning works in current Large Language Models (LLMs) that function using the token-completion method. It examines their stochastic nature and their similarity to human abductive reasoning. The argument is that these LLMs create text based on learned patterns rather than performing actual abductive reasoning. When their output seems abductive, this is largely because they are trained on human-generated texts that include reasoning structures. Examples are used to show how LLMs can produce plausible ideas, mimic commonsense reasoning, and give explanatory answers without being grounded in truth, semantics, verification, or understanding, and without performing any real abductive reasoning. This dual nature, where the models have a stochastic base but appear abductive in use, has important consequences for how LLMs are evaluated and applied. They can assist with generating ideas and supporting human thinking, but their outputs must be critically assessed because they cannot identify truth or verify their explanations. The article concludes by addressing five objections to these points, noting some limitations in the analysis, and offering an overall evaluation.",2025-12-10 21:06:28+00:00,"['cs.CL', 'cs.AI']",https://arxiv.org/pdf/2512.10080v1
Openpi Comet: Competition Solution For 2025 BEHAVIOR Challenge,"The 2025 BEHAVIOR Challenge is designed to rigorously track progress toward solving long-horizon tasks by physical agents in simulated environments. BEHAVIOR-1K focuses on everyday household tasks that people most want robots to assist with and these tasks introduce long-horizon mobile manipulation challenges in realistic settings, bridging the gap between current research and real-world, human-centric applications. This report presents our solution to the 2025 BEHAVIOR Challenge in a very close 2nd place and substantially outperforms the rest of the submissions. Building on $π_{0.5}$, we focus on systematically building our solution by studying the effects of training techniques and data. Through careful ablations, we show the scaling power in pre-training and post-training phases for competitive performance. We summarize our practical lessons and design recommendations that we hope will provide actionable insights for the broader embodied AI community when adapting powerful foundation models to complex embodied scenarios.",2025-12-10 20:46:40+00:00,['cs.RO'],https://arxiv.org/pdf/2512.10071v1
Classifying Metamorphic versus Single-Fold Proteins with Statistical Learning and AlphaFold2,"The remarkable success of AlphaFold2 in providing accurate atomic-level prediction of protein structures from their amino acid sequence has transformed approaches to the protein folding problem. However, its core paradigm of mapping one sequence to one structure may only be appropriate for single-fold proteins with one stable conformation. Metamorphic proteins, which can adopt multiple distinct conformations, have conformational diversity that cannot be adequately modeled by AlphaFold2. Hence, classifying whether a given protein is metamorphic or single-fold remains a critical challenge for both laboratory experiments and computational methods. To address this challenge, we developed a novel classification framework by re-purposing AlphaFold2 to generate conformational ensembles via a multiple sequence alignment sampling method. From these ensembles, we extract a comprehensive set of features characterizing the conformational ensemble's modality and structural dispersion. A random forest classifier trained on a carefully curated benchmark dataset of known metamorphic and single-fold proteins achieves a mean AUC of 0.869 with cross-validation, demonstrating the effectiveness of our integrated approach. Furthermore, by applying our classifier to 600 randomly sampled proteins from the Protein Data Bank, we identified several potential metamorphic protein candidates -- including the 40S ribosomal protein S30, whose conformational change is crucial for its secondary function in antimicrobial defense. By combining AI-driven protein structure prediction with statistical learning, our work provides a powerful new approach for discovering metamorphic proteins and deepens our understanding of their role in their molecular function.",2025-12-10 20:37:21+00:00,"['stat.AP', 'cs.AI']",https://arxiv.org/pdf/2512.10066v1
